{
  "contract_version": "1.0.0",
  "signal_id": "sig_seed_0188",
  "channel": "citizen_seed",
  "source": {
    "source_id": "src_archived_0203",
    "platform": "archived_post",
    "author_ref": "reporter_203",
    "url": null,
    "received_at": "2026-07-26T08:31:00Z",
    "replay_offset_s": 1140
  },
  "raw": {
    "text": "ILLUSTRATIVE FIXTURE - planted fake for testing. Zindabazar puro dube gese, sob building er chal porjonto pani.",
    "lang": "bn-latn",
    "media_refs": [],
    "imagery_ref": null
  },
  "claim": {
    "location_ref": "Zindabazar",
    "event_type": "flood_inundation",
    "urgency": "critical",
    "persons_at_risk": null,
    "claimed_time": "2026-07-26T08:10:00Z",
    "needs": ["rescue"],
    "summary_en": "Claims Zindabazar entirely submerged to rooflines."
  },
  "geo": {
    "lon": 91.8687,
    "lat": 24.8949,
    "grid_cell_id": "c_9187_2489",
    "geocode": {
      "method": "geonames_fuzzy",
      "matched_name": "Zindabazar",
      "admin": "Sylhet Division / Sylhet City",
      "score": 0.91,
      "ambiguous": false,
      "candidates": []
    }
  },
  "verification": {
    "tier": "suspect",
    "reason": "Claim asserts total roofline inundation in cell c_9187_2489, but that cell is inside the imagery valid-area mask and the damage layer scored 0 of 148 assessed buildings as damaged. Single source, no corroboration. Held for human review; contributes no weight to the triage score.",
    "corroborating_signal_ids": [],
    "distinct_source_count": 1,
    "spatial_check": {
      "status": "contradicted",
      "inside_valid_area": true,
      "buildings_in_radius": 148,
      "damaged_in_radius": 0,
      "radius_m": 500
    },
    "fusion_weight": 0.0,
    "recon_priority": false,
    "verified_at": "2026-07-26T08:31:20Z"
  },
  "extraction": {
    "model": "gemini-2.5-flash",
    "prompt_version": "extract-v1",
    "extracted_at": "2026-07-26T08:31:08Z",
    "confidence": 0.79,
    "cached": true
  },
  "eval": {
    "planted_fake": true,
    "fake_kind": "contradicts_imagery",
    "expected_tier": "suspect",
    "provenance_note": "FIXTURE. Synthetic planted fake; must be clearly separable from the real archived rows in the seed file."
  }
}
